{
  "schema": "cm13-formula-snapshot-v1",
  "source": {
    "name": "pipeline_sat.cm13",
    "sha256": "3caaa6b29ac988fb4f51cc7071202d83ea1591ba6170e683b6da449cb3641542"
  },
  "variable_count": 3,
  "clauses": [
    {
      "clause_id": 0,
      "variables": [
        0,
        0,
        1
      ]
    },
    {
      "clause_id": 1,
      "variables": [
        0,
        1,
        2
      ]
    },
    {
      "clause_id": 2,
      "variables": [
        1,
        2,
        2
      ]
    }
  ]
}
